{
  "generated_at": "2026-10-11T11:00:28+00:00",
  "mode": "CI/strict",
  "verdict": "PASS",
  "assertions": [
    {
      "label": "Decision Consistency",
      "status": "PASS",
      "status_code": 0,
      "brief": "ASSERTION PASSED \u2014 constitutional gate.is_constitutional_buy is single s"
    },
    {
      "label": "Full Universe Replay",
      "status": "PASS",
      "status_code": 0,
      "brief": "ASSERTION PASSED \u2014 all 27 tickers replay identically."
    },
    {
      "label": "Cross Layer Consistency",
      "status": "PASS",
      "status_code": 0,
      "brief": "ASSERTION PASSED \u2014 all layers agree on constitutional decisions."
    },
    {
      "label": "Rendered Output",
      "status": "PASS",
      "status_code": 0,
      "brief": "ASSERTION PASSED \u2014 rendered dashboard consistent with production snapsho"
    },
    {
      "label": "Event Chain Integrity",
      "status": "PASS",
      "status_code": 0,
      "brief": "ASSERTION PASSED \u2014 7 event chain(s) intact."
    },
    {
      "label": "Data Freshness",
      "status": "PASS",
      "status_code": 0,
      "brief": "ASSERTION PASSED \u2014 all required data sources are fresh."
    },
    {
      "label": "Workflow Completeness",
      "status": "PASS",
      "status_code": 0,
      "brief": "ASSERTION PASSED \u2014 all required pipeline stages completed."
    },
    {
      "label": "Decision Replay",
      "status": "PASS",
      "status_code": 0,
      "brief": "ASSERTION PASSED \u2014 all gate replays match production."
    },
    {
      "label": "Regression Suite",
      "status": "PASS",
      "status_code": 0,
      "brief": "ASSERTION PASSED \u2014 all regression tests pass."
    },
    {
      "label": "Presentation Consistency",
      "status": "PASS",
      "status_code": 0,
      "brief": "ASSERTION PASSED \u2014 presentation_snapshot.json is internally consistent."
    },
    {
      "label": "Price Consistency",
      "status": "PASS",
      "status_code": 0,
      "brief": "ASSERTION PASSED \u2014 all snapshot sections show identical current prices."
    },
    {
      "label": "Ci Protection",
      "status": "PASS",
      "status_code": 0,
      "brief": "CI GATE PASSED \u2014 all invariants satisfied."
    },
    {
      "label": "Production Invariants",
      "status": "PASS",
      "status_code": 0,
      "brief": "ASSERTION PASSED \u2014 no Partial Execution invariant violations detected."
    },
    {
      "label": "No Direct Notify Calls",
      "status": "PASS",
      "status_code": 0,
      "brief": "ASSERTION PASSED \u2014 all notification calls are routed through ProductionT"
    },
    {
      "label": "Fault Injection",
      "status": "PASS",
      "status_code": 0,
      "brief": "ASSERTION PASSED \u2014 all fault injection tests confirm:"
    },
    {
      "label": "Scan Id Consistency",
      "status": "PASS",
      "status_code": 0,
      "brief": "ASSERTION PASSED \u2014 scan_id propagated consistently across all artifacts."
    },
    {
      "label": "Schema Compliance",
      "status": "PASS",
      "status_code": 0,
      "brief": "ASSERTION PASSED \u2014 all artifacts comply with their JSON Schema contracts"
    },
    {
      "label": "E2E Constitutional Audit",
      "status": "PASS",
      "status_code": 0,
      "brief": "CONSTITUTIONAL INTEGRITY: PASS"
    },
    {
      "label": "Scan Manifest",
      "status": "PASS",
      "status_code": 0,
      "brief": "PASS: scan_manifest.json is valid and consistent"
    }
  ],
  "summary": {
    "pass": 19,
    "fail": 0,
    "expected": 0,
    "skipped": 0
  }
}